{"schema_version":"1.0","component":"DSG.EquipmentPerformanceRegistry.F4.ReadModel","authority":"projection","action_authority":"NONE","source_contract":{"f3_projection":"docs/data/equipment-performance-registry-f3.json","f4_contract":"docs/architecture/telemetry/BKL-039-F4-Equipment-Performance-Read-Only-Consumer-Contract.md","accepted_f3_merge":"ce2482aa6b2da62296ebdc221f73f39c1acd3aa2"},"view":{"configuration_id":"QUATTRO200_TOUPTEK294_BIN1","session_id":"2026-07-14_2026-07-15","target_name":"LDN 1320","filter_name":"LPRO","frame_type":"LIGHT","metric_name":"FWHM","unit":"NINA_FILENAME_FWHM_SOURCE_UNIT","unit_semantics":"SOURCE_NATIVE_UNCALIBRATED","angular_calibration_state":"NOT_PROVEN","measurement_count":19,"coverage":"COMPLETE_FOR_DECLARED_POPULATION","measurement_method_id":"BKL039-F3-FWHM-NINA-FILENAME-EXTRACT-V1","source_record_refs":["data/analytics/history/target-exposures.csv#2026-07-14_2026-07-15:line=1762","data/analytics/history/target-exposures.csv#2026-07-14_2026-07-15:line=1837","data/analytics/history/target-exposures.csv#2026-07-14_2026-07-15:line=1862","data/analytics/history/target-exposures.csv#2026-07-14_2026-07-15:line=1883","data/analytics/history/target-exposures.csv#2026-07-14_2026-07-15:line=1992","data/analytics/history/target-exposures.csv#2026-07-14_2026-07-15:line=2060","data/analytics/history/target-exposures.csv#2026-07-14_2026-07-15:line=2124","data/analytics/history/target-exposures.csv#2026-07-14_2026-07-15:line=2189","data/analytics/history/target-exposures.csv#2026-07-14_2026-07-15:line=2259","data/analytics/history/target-exposures.csv#2026-07-14_2026-07-15:line=2324","data/analytics/history/target-exposures.csv#2026-07-14_2026-07-15:line=2389","data/analytics/history/target-exposures.csv#2026-07-14_2026-07-15:line=2458","data/analytics/history/target-exposures.csv#2026-07-14_2026-07-15:line=2534","data/analytics/history/target-exposures.csv#2026-07-14_2026-07-15:line=2586","data/analytics/history/target-exposures.csv#2026-07-14_2026-07-15:line=2656","data/analytics/history/target-exposures.csv#2026-07-14_2026-07-15:line=2720","data/analytics/history/target-exposures.csv#2026-07-14_2026-07-15:line=2784","data/analytics/history/target-exposures.csv#2026-07-14_2026-07-15:line=2853","data/analytics/history/target-exposures.csv#2026-07-14_2026-07-15:line=2935"],"citation_refs":["data/analytics/history/target-exposures.csv","data/analytics/history/target-summary.csv"],"provenance_refs":["docs/architecture/telemetry/BKL-039-F3-Descriptive-Performance-Measurement-and-Aggregation-Contract.md","docs/data/equipment-performance-registry-f2-fixture.json"],"measurements":[{"record_id":"EPR-F3-FWHM-2026-07-14_2026-07-15-0000","sequence_number":"0000","timestamp":"2026-07-15T00:22:34.244900+02:00","value":8.45,"source_record_ref":"data/analytics/history/target-exposures.csv#2026-07-14_2026-07-15:line=1762"},{"record_id":"EPR-F3-FWHM-2026-07-14_2026-07-15-0001","sequence_number":"0001","timestamp":"2026-07-15T00:35:16.296100+02:00","value":7.7,"source_record_ref":"data/analytics/history/target-exposures.csv#2026-07-14_2026-07-15:line=1837"},{"record_id":"EPR-F3-FWHM-2026-07-14_2026-07-15-0002","sequence_number":"0002","timestamp":"2026-07-15T00:45:38.274900+02:00","value":7.77,"source_record_ref":"data/analytics/history/target-exposures.csv#2026-07-14_2026-07-15:line=1862"},{"record_id":"EPR-F3-FWHM-2026-07-14_2026-07-15-0003","sequence_number":"0003","timestamp":"2026-07-15T00:55:54.053200+02:00","value":8.21,"source_record_ref":"data/analytics/history/target-exposures.csv#2026-07-14_2026-07-15:line=1883"},{"record_id":"EPR-F3-FWHM-2026-07-14_2026-07-15-0004","sequence_number":"0004","timestamp":"2026-07-15T01:12:31.221100+02:00","value":7.29,"source_record_ref":"data/analytics/history/target-exposures.csv#2026-07-14_2026-07-15:line=1992"},{"record_id":"EPR-F3-FWHM-2026-07-14_2026-07-15-0005","sequence_number":"0005","timestamp":"2026-07-15T01:25:50.617800+02:00","value":7.52,"source_record_ref":"data/analytics/history/target-exposures.csv#2026-07-14_2026-07-15:line=2060"},{"record_id":"EPR-F3-FWHM-2026-07-14_2026-07-15-0006","sequence_number":"0006","timestamp":"2026-07-15T01:39:07.929100+02:00","value":7.79,"source_record_ref":"data/analytics/history/target-exposures.csv#2026-07-14_2026-07-15:line=2124"},{"record_id":"EPR-F3-FWHM-2026-07-14_2026-07-15-0007","sequence_number":"0007","timestamp":"2026-07-15T01:52:35.844200+02:00","value":7.85,"source_record_ref":"data/analytics/history/target-exposures.csv#2026-07-14_2026-07-15:line=2189"},{"record_id":"EPR-F3-FWHM-2026-07-14_2026-07-15-0008","sequence_number":"0008","timestamp":"2026-07-15T02:06:17.121600+02:00","value":9.05,"source_record_ref":"data/analytics/history/target-exposures.csv#2026-07-14_2026-07-15:line=2259"},{"record_id":"EPR-F3-FWHM-2026-07-14_2026-07-15-0009","sequence_number":"0009","timestamp":"2026-07-15T02:20:05.070200+02:00","value":8.22,"source_record_ref":"data/analytics/history/target-exposures.csv#2026-07-14_2026-07-15:line=2324"},{"record_id":"EPR-F3-FWHM-2026-07-14_2026-07-15-0010","sequence_number":"0010","timestamp":"2026-07-15T02:33:52.010100+02:00","value":7.24,"source_record_ref":"data/analytics/history/target-exposures.csv#2026-07-14_2026-07-15:line=2389"},{"record_id":"EPR-F3-FWHM-2026-07-14_2026-07-15-0011","sequence_number":"0011","timestamp":"2026-07-15T02:47:26.773800+02:00","value":6.96,"source_record_ref":"data/analytics/history/target-exposures.csv#2026-07-14_2026-07-15:line=2458"},{"record_id":"EPR-F3-FWHM-2026-07-14_2026-07-15-0012","sequence_number":"0012","timestamp":"2026-07-15T03:00:56.810500+02:00","value":7.45,"source_record_ref":"data/analytics/history/target-exposures.csv#2026-07-14_2026-07-15:line=2534"},{"record_id":"EPR-F3-FWHM-2026-07-14_2026-07-15-0013","sequence_number":"0013","timestamp":"2026-07-15T03:14:08.856100+02:00","value":7.63,"source_record_ref":"data/analytics/history/target-exposures.csv#2026-07-14_2026-07-15:line=2586"},{"record_id":"EPR-F3-FWHM-2026-07-14_2026-07-15-0014","sequence_number":"0014","timestamp":"2026-07-15T03:27:35.869500+02:00","value":7.21,"source_record_ref":"data/analytics/history/target-exposures.csv#2026-07-14_2026-07-15:line=2656"},{"record_id":"EPR-F3-FWHM-2026-07-14_2026-07-15-0015","sequence_number":"0015","timestamp":"2026-07-15T03:40:57.397200+02:00","value":7.15,"source_record_ref":"data/analytics/history/target-exposures.csv#2026-07-14_2026-07-15:line=2720"},{"record_id":"EPR-F3-FWHM-2026-07-14_2026-07-15-0016","sequence_number":"0016","timestamp":"2026-07-15T03:54:12.578800+02:00","value":7.04,"source_record_ref":"data/analytics/history/target-exposures.csv#2026-07-14_2026-07-15:line=2784"},{"record_id":"EPR-F3-FWHM-2026-07-14_2026-07-15-0017","sequence_number":"0017","timestamp":"2026-07-15T04:07:44.822500+02:00","value":6.78,"source_record_ref":"data/analytics/history/target-exposures.csv#2026-07-14_2026-07-15:line=2853"},{"record_id":"EPR-F3-FWHM-2026-07-14_2026-07-15-0018","sequence_number":"0018","timestamp":"2026-07-15T04:22:47.633400+02:00","value":7.08,"source_record_ref":"data/analytics/history/target-exposures.csv#2026-07-14_2026-07-15:line=2935"}],"statistics":[{"record_id":"EPR-F3-FWHM-2026-07-14_2026-07-15-MEAN","statistic_type":"MEAN","value":7.5995,"method_id":"BKL039-F3-FWHM-MEAN-V1","sample_count":19},{"record_id":"EPR-F3-FWHM-2026-07-14_2026-07-15-MINIMUM","statistic_type":"MINIMUM","value":6.78,"method_id":"BKL039-F3-FWHM-MIN-V1","sample_count":19},{"record_id":"EPR-F3-FWHM-2026-07-14_2026-07-15-MAXIMUM","statistic_type":"MAXIMUM","value":9.05,"method_id":"BKL039-F3-FWHM-MAX-V1","sample_count":19},{"record_id":"EPR-F3-FWHM-2026-07-14_2026-07-15-SAMPLE_STDDEV","statistic_type":"SAMPLE_STDDEV","value":0.5771,"method_id":"BKL039-F3-FWHM-SAMPLE-STDDEV-V1","sample_count":19}],"limitations":["SOURCE_NATIVE_FWHM_UNIT_IS_NOT_PHYSICALLY_CALIBRATED","NO_EQUIPMENT_HEALTH_RANKING_THRESHOLD_OR_RECOMMENDATION","HISTORICAL_READ_ONLY_PROJECTION_NOT_SAFETY_AUTHORITY"]}}
